{
  "schemaVersion": "1.0.0",
  "workspaceId": "e4d99f54-5f04-4f20-8544-330c41232965",
  "updatedAt": "2026-09-15T21:08:01.426Z",
  "notes": "Seeded from data/production/runs/*-results.json uploadHandles. Key is assetId + sha256 of current staging bytes (resolveStretchStagingSource). Voice assets with seedanceUploadPath are not seeded from historical handles (often full WAV).",
  "entries": [
    {
      "assetId": "asset:character-harlan-sheet",
      "sha256": "719392421fb58cd49dadc63a1cf72f0f6da480730d906800b0b917eabdf75092",
      "mediaId": "a4cfc514-9708-4a76-80d8-a8b38979eec9",
      "kind": "image",
      "workspaceId": "e4d99f54-5f04-4f20-8544-330c41232965",
      "sourceRunId": "run:festival-master:stretch-service-cylinder-harlan-okoye-045b:rev-1:video-1:ready",
      "uploadedAt": "2026-09-15T21:07:35.934Z",
      "localPath": "static/assets/characters/harlan/model-sheet-v2.png",
      "seedConfidence": "assumed_current_bytes"
    },
    {
      "assetId": "asset:character-okoye-sheet",
      "sha256": "55eb50ab4f3ae90c8f3c0defb1dee7268bc445ba8925caa20bf2a253b5a0cda0",
      "mediaId": "d275cf75-6828-4acc-8d27-dba850214e29",
      "kind": "image",
      "workspaceId": "e4d99f54-5f04-4f20-8544-330c41232965",
      "sourceRunId": "run:festival-master:stretch-service-cylinder-harlan-okoye-045b:rev-1:video-1:ready",
      "uploadedAt": "2026-09-15T21:07:35.934Z",
      "localPath": "static/assets/characters/okoye/model-sheet.png",
      "seedConfidence": "assumed_current_bytes"
    },
    {
      "assetId": "asset:character-periodista-sheet",
      "sha256": "02e2fc7af0a27d368970cf439140e5ed0f4dd4431bd73de298db27452ba69a29",
      "mediaId": "efdf1726-542d-48f0-90e4-90fec35a1b88",
      "kind": "image",
      "workspaceId": "e4d99f54-5f04-4f20-8544-330c41232965",
      "sourceRunId": "run:festival-master:stretch-operations-gallery-001-003:rev-1:video-1:ready",
      "uploadedAt": "2026-09-14T20:55:00Z",
      "localPath": "static/assets/characters/periodista/model-sheet.png",
      "seedConfidence": "assumed_current_bytes"
    },
    {
      "assetId": "asset:character-rao-sheet",
      "sha256": "673bc28bdf6bd0a4f0142c9f34a72c13b8b26ba2c8e84fd1d8fc630663d72641",
      "mediaId": "b33b42f4-3abf-457e-af8c-3f769025cbc1",
      "kind": "image",
      "workspaceId": "e4d99f54-5f04-4f20-8544-330c41232965",
      "sourceRunId": "run:festival-master:stretch-bridge-harlan-alibi-045:rev-1:video-1:ready",
      "uploadedAt": "2026-09-15T21:06:28.867Z",
      "localPath": "static/assets/characters/rao/model-sheet.png",
      "seedConfidence": "assumed_current_bytes"
    },
    {
      "assetId": "asset:character-sorell-sheet",
      "sha256": "0938a259dabbeb42f87d8d28b3160d7a39bb38a6b9b36d3ac616a09ea6d697e6",
      "mediaId": "6ad0326d-d672-4834-b2ac-14e748528407",
      "kind": "image",
      "workspaceId": "e4d99f54-5f04-4f20-8544-330c41232965",
      "sourceRunId": "run:festival-master:stretch-reactor-sorell-042-043:rev-1:video-2:ready",
      "uploadedAt": "2026-09-15T21:06:28.689Z",
      "localPath": "static/assets/characters/sorell/model-sheet.png",
      "seedConfidence": "assumed_current_bytes"
    },
    {
      "assetId": "asset:character-voss-sheet",
      "sha256": "ba66028c0801c18af911364a95eae1d9e01317ba65c14859c6c001b949f94b4f",
      "mediaId": "88fed050-c15b-4950-a779-d67ec203a29f",
      "kind": "image",
      "workspaceId": "e4d99f54-5f04-4f20-8544-330c41232965",
      "sourceRunId": "run:festival-master:stretch-bridge-harlan-alibi-045:rev-1:video-1:ready",
      "uploadedAt": "2026-09-15T21:06:28.867Z",
      "localPath": "static/assets/characters/voss/model-sheet.png",
      "seedConfidence": "assumed_current_bytes"
    },
    {
      "assetId": "asset:character-zao-sheet",
      "sha256": "04d8e932f68c7e567ed6c4f2353340349e109a8754630f49b1d2c38621fe728e",
      "mediaId": "9ac9d629-25e6-4e96-bfad-63ecb70e705b",
      "kind": "image",
      "workspaceId": "e4d99f54-5f04-4f20-8544-330c41232965",
      "sourceRunId": "run:festival-master:stretch-reactor-confront-036-038:rev-1:video-3:ready",
      "uploadedAt": "2026-09-15T19:12:00Z",
      "localPath": "static/assets/characters/zao/model-sheet.png",
      "seedConfidence": "assumed_current_bytes"
    },
    {
      "assetId": "asset:festival-master-storyboard-039",
      "sha256": "8918109b8f66dfd32a4305ee09463565c4f5f8190a57e21533da2ea4d528accb",
      "mediaId": "fa8f741e-54b5-4c1d-ab0a-156920055d6f",
      "kind": "image",
      "workspaceId": "e4d99f54-5f04-4f20-8544-330c41232965",
      "sourceRunId": "run:festival-master:shot-plan-039:rev-1:video-1:ready",
      "uploadedAt": "2026-09-14T23:24:30Z",
      "localPath": "static/assets/animatic/frames/festival-master/shot-plan-039.png",
      "seedConfidence": "assumed_current_bytes"
    },
    {
      "assetId": "asset:festival-master-storyboard-040b",
      "sha256": "109bfd8c33abb7c2f9db416eaea2d8ae60dafb2e3dae8439da594ababe65df71",
      "mediaId": "2436c3ce-1ba3-41b8-9240-1bf87e604191",
      "kind": "image",
      "workspaceId": "e4d99f54-5f04-4f20-8544-330c41232965",
      "sourceRunId": "run:festival-master:shot-plan-040b:rev-1:video-1:ready",
      "uploadedAt": "2026-09-14T22:52:17Z",
      "localPath": "static/assets/animatic/frames/festival-master/shot-plan-040b.png",
      "seedConfidence": "assumed_current_bytes"
    },
    {
      "assetId": "asset:festival-master-storyboard-087",
      "sha256": "19996996e299d62cde6fd2892dfad204b7008d6f1d606879892a7ee98f3755d2",
      "mediaId": "12f95bd2-419c-47cd-b555-8e6af07daa5d",
      "kind": "image",
      "workspaceId": "e4d99f54-5f04-4f20-8544-330c41232965",
      "sourceRunId": "run:trailer-master:title-end-earth-jupiter:rev-1:video-1:ready",
      "uploadedAt": "2026-09-14T22:13:05Z",
      "localPath": "static/assets/animatic/frames/festival-master/shot-plan-087.png",
      "seedConfidence": "assumed_current_bytes"
    },
    {
      "assetId": "asset:festival-master-stretch-bridge-investigation-046-049-panel-01",
      "sha256": "bf9ce24534faad4116ebddc31ebdb7deb8fdb4c13479db6ebea362e84a234b31",
      "mediaId": "c4e01881-6601-4c37-96a4-364c46588d27",
      "kind": "image",
      "workspaceId": "e4d99f54-5f04-4f20-8544-330c41232965",
      "sourceRunId": "run:festival-master:stretch-bridge-investigation-046-049:rev-1:video-1:ready",
      "uploadedAt": "2026-09-14T21:34:05.310Z",
      "localPath": "static/assets/animatic/frames/festival-master/stretches/festival-master-stretch-bridge-investigation-046-049/panel-01.png",
      "seedConfidence": "assumed_current_bytes"
    },
    {
      "assetId": "asset:festival-master-stretch-bridge-investigation-046-049-panel-02",
      "sha256": "e5757eef7559b5f2007baa40b27f661279568ec41829b3d766c6523e58e7c633",
      "mediaId": "0f762b4c-ba76-44c1-9a4a-af6dad35e4da",
      "kind": "image",
      "workspaceId": "e4d99f54-5f04-4f20-8544-330c41232965",
      "sourceRunId": "run:festival-master:stretch-bridge-investigation-046-049:rev-1:video-1:ready",
      "uploadedAt": "2026-09-14T21:34:05.310Z",
      "localPath": "static/assets/animatic/frames/festival-master/stretches/festival-master-stretch-bridge-investigation-046-049/panel-02.png",
      "seedConfidence": "assumed_current_bytes"
    },
    {
      "assetId": "asset:festival-master-stretch-bridge-investigation-046-049-panel-03",
      "sha256": "7a3467252dc06ece0f6f56671dbb2eb50e7d8b8d8f7b46403681b748a8160392",
      "mediaId": "bb41627d-645e-4c78-a5b3-d6e7fde98a60",
      "kind": "image",
      "workspaceId": "e4d99f54-5f04-4f20-8544-330c41232965",
      "sourceRunId": "run:festival-master:stretch-bridge-investigation-046-049:rev-1:video-1:ready",
      "uploadedAt": "2026-09-14T21:34:05.310Z",
      "localPath": "static/assets/animatic/frames/festival-master/stretches/festival-master-stretch-bridge-investigation-046-049/panel-03.png",
      "seedConfidence": "assumed_current_bytes"
    },
    {
      "assetId": "asset:festival-master-stretch-bridge-investigation-046-049-panel-04",
      "sha256": "272f283b4670d9edba2efc127f2118a1791270f51b574624af9fe189533b8022",
      "mediaId": "f34fb160-97a6-4c06-91e7-3de0b4ceb248",
      "kind": "image",
      "workspaceId": "e4d99f54-5f04-4f20-8544-330c41232965",
      "sourceRunId": "run:festival-master:stretch-bridge-investigation-046-049:rev-1:video-1:ready",
      "uploadedAt": "2026-09-14T21:34:05.310Z",
      "localPath": "static/assets/animatic/frames/festival-master/stretches/festival-master-stretch-bridge-investigation-046-049/panel-04.png",
      "seedConfidence": "assumed_current_bytes"
    },
    {
      "assetId": "asset:festival-master-stretch-bridge-meal-010-012-panel-01",
      "sha256": "b0d0f2b2c09e9867a36bc759efeab77ff30f785cabe0be78915b75f80c067328",
      "mediaId": "43b09cea-742e-49e6-8568-8129452e0a14",
      "kind": "image",
      "workspaceId": "e4d99f54-5f04-4f20-8544-330c41232965",
      "sourceRunId": "run:festival-master:stretch-bridge-meal-010-012:rev-2:video-1:ready",
      "uploadedAt": "2026-09-14T21:34:04.280Z",
      "localPath": "static/assets/animatic/frames/festival-master/stretches/festival-master-stretch-bridge-meal-010-012/panel-01.png",
      "seedConfidence": "assumed_current_bytes"
    },
    {
      "assetId": "asset:festival-master-stretch-bridge-meal-010-012-panel-02",
      "sha256": "400448c2826558b9b8ee5e38e03d39e636c99de8e7e56163c1a553839059ac12",
      "mediaId": "164ea611-b6b9-47a5-ab6b-39007bfaefea",
      "kind": "image",
      "workspaceId": "e4d99f54-5f04-4f20-8544-330c41232965",
      "sourceRunId": "run:festival-master:stretch-bridge-meal-010-012:rev-2:video-1:ready",
      "uploadedAt": "2026-09-14T21:34:04.280Z",
      "localPath": "static/assets/animatic/frames/festival-master/stretches/festival-master-stretch-bridge-meal-010-012/panel-02.png",
      "seedConfidence": "assumed_current_bytes"
    },
    {
      "assetId": "asset:festival-master-stretch-bridge-meal-010-012-panel-03",